{
  "description": "v0.5.1 bilingual four-family Core successor fixture.",
  "expected_item_ids": [
    "zh-cn/api-management",
    "en-us/api-management",
    "zh-cn/cloud-services",
    "en-us/cloud-services",
    "zh-cn/service-bus",
    "en-us/service-bus",
    "zh-cn/icp-faq",
    "en-us/icp-faq"
  ],
  "frozen_inputs": {
    "content_sampling_profile": {
      "id": "v0.4-content-sampling-p3",
      "path": "data/configs/content-sampling-profiles/v0.4-p3.json",
      "schema_version": "1.0",
      "sha256": "2e2c33cd964ea73435a3f83c076dcdc114ee73c88e2d00c7c3c8cd4c6dd75cb0"
    },
    "finding_code_policy": {
      "id": "v0.4-finding-code-policy-p4",
      "path": "data/configs/finding-code-policies/v0.4-p4.json",
      "schema_version": "1.0",
      "sha256": "bed3c18a753a7e3d7a3c00ec6d690a953e3794e1f43472508290637f9266a06b"
    },
    "planning_baseline": {
      "id": "v0.5.1-planning-baseline",
      "path": "data/baselines/v0.5/planning-baseline.json",
      "schema_version": "2.0",
      "sha256": "7855b23961faac8ece8505a2ad09e6964d28298167331e83e2ca14c02e350958"
    },
    "soft_category": {
      "path": "data/configs/soft-category.json",
      "sha256": "3c930c6e163f27bbbbc4e44c8597feb3d112518ffcc309ee5b7bc007978f02d8"
    },
    "validation_profile": {
      "id": "v0.4-validation-p3-successor",
      "path": "data/configs/validation-profiles/v0.4-p3-successor.json",
      "schema_version": "1.3",
      "sha256": "e45ad2ba22c1a9ee91d735f18177f3e0824b01806793573112e8f15f26f94d82"
    }
  },
  "items": [
    {
      "artifacts": {
        "diagnostic": {
          "path": "diagnostics/zh-cn/pricing/api-management.sidecar.json"
        },
        "parseability": {
          "path": "diagnostics/zh-cn/pricing/api-management.parseability.json"
        },
        "payload": {
          "path": "outputs/zh-cn/pricing/api-management.json"
        },
        "validation": {
          "path": "validation/zh-cn/pricing/api-management.validation.json"
        }
      },
      "capability_status": "supported",
      "catalog_categories": [
        "integration"
      ],
      "config": {
        "path": "data/configs/products/pricing/api-management.json",
        "sha256": "8210aefca6560368c5571ccd9e2431eb04ac0ce3bd4ad6e47f8518e4f7513676"
      },
      "item_id": "zh-cn/api-management",
      "language": "zh-cn",
      "normalized_input": {
        "path": "data/prod-html/zh-cn/pricing/api-management.html",
        "sha256": "2ff654ac44611f422bdcc7113fba03b7293a1f4c1f2e51b118db8568e7eb45b4"
      },
      "page_model": "FlexibleContentPage",
      "product_key": "api-management",
      "resource_key": "api-management",
      "resource_kind": "current",
      "slug": "api-management",
      "source": {
        "availability": "available",
        "cms_path": null,
        "path": "data/current_prod_html/zh-cn/pricing/details/api-management/index.html",
        "sha256": "2ff654ac44611f422bdcc7113fba03b7293a1f4c1f2e51b118db8568e7eb45b4",
        "url": "https://www.azure.cn/pricing/details/api-management/"
      },
      "strategy": "region_filter",
      "support_article_type": null
    },
    {
      "artifacts": {
        "diagnostic": {
          "path": "diagnostics/en-us/pricing/api-management.sidecar.json"
        },
        "parseability": {
          "path": "diagnostics/en-us/pricing/api-management.parseability.json"
        },
        "payload": {
          "path": "outputs/en-us/pricing/api-management.json"
        },
        "validation": {
          "path": "validation/en-us/pricing/api-management.validation.json"
        }
      },
      "capability_status": "supported",
      "catalog_categories": [
        "integration"
      ],
      "config": {
        "path": "data/configs/products/pricing/api-management.json",
        "sha256": "8210aefca6560368c5571ccd9e2431eb04ac0ce3bd4ad6e47f8518e4f7513676"
      },
      "item_id": "en-us/api-management",
      "language": "en-us",
      "normalized_input": {
        "path": "data/prod-html/en-us/pricing/api-management.html",
        "sha256": "67b1afe40512e4e8d324c83a78d23cf875083a69c1a6192e39cc9dd17c7e5b07"
      },
      "page_model": "FlexibleContentPage",
      "product_key": "api-management",
      "resource_key": "api-management",
      "resource_kind": "current",
      "slug": "api-management",
      "source": {
        "availability": "available",
        "cms_path": null,
        "path": "data/current_prod_html/en-us/pricing/details/api-management/index.html",
        "sha256": "67b1afe40512e4e8d324c83a78d23cf875083a69c1a6192e39cc9dd17c7e5b07",
        "url": "https://www.azure.cn/en-us/pricing/details/api-management/"
      },
      "strategy": "region_filter",
      "support_article_type": null
    },
    {
      "artifacts": {
        "diagnostic": {
          "path": "diagnostics/zh-cn/pricing/cloud-services.sidecar.json"
        },
        "parseability": {
          "path": "diagnostics/zh-cn/pricing/cloud-services.parseability.json"
        },
        "payload": {
          "path": "outputs/zh-cn/pricing/cloud-services.json"
        },
        "validation": {
          "path": "validation/zh-cn/pricing/cloud-services.validation.json"
        }
      },
      "capability_status": "supported",
      "catalog_categories": [
        "compute"
      ],
      "config": {
        "path": "data/configs/products/pricing/cloud-services.json",
        "sha256": "51bc6cc2d0e49c047026d63efcaf1d50f1725cc50508ce6f13c3708c3ab09872"
      },
      "item_id": "zh-cn/cloud-services",
      "language": "zh-cn",
      "normalized_input": {
        "path": "data/prod-html/zh-cn/pricing/cloud-services.html",
        "sha256": "7a18c3d8b16116ac7fe4ad572bcd6e3e099ff1b04249c78d8b56cfac49052486"
      },
      "page_model": "FlexibleContentPage",
      "product_key": "cloud-services",
      "resource_key": "cloud-services",
      "resource_kind": "current",
      "slug": "cloud-services",
      "source": {
        "availability": "available",
        "cms_path": null,
        "path": "data/current_prod_html/zh-cn/pricing/details/cloud-services/index.html",
        "sha256": "7a18c3d8b16116ac7fe4ad572bcd6e3e099ff1b04249c78d8b56cfac49052486",
        "url": "https://www.azure.cn/pricing/details/cloud-services/"
      },
      "strategy": "complex",
      "support_article_type": null
    },
    {
      "artifacts": {
        "diagnostic": {
          "path": "diagnostics/en-us/pricing/cloud-services.sidecar.json"
        },
        "parseability": {
          "path": "diagnostics/en-us/pricing/cloud-services.parseability.json"
        },
        "payload": {
          "path": "outputs/en-us/pricing/cloud-services.json"
        },
        "validation": {
          "path": "validation/en-us/pricing/cloud-services.validation.json"
        }
      },
      "capability_status": "supported",
      "catalog_categories": [
        "compute"
      ],
      "config": {
        "path": "data/configs/products/pricing/cloud-services.json",
        "sha256": "51bc6cc2d0e49c047026d63efcaf1d50f1725cc50508ce6f13c3708c3ab09872"
      },
      "item_id": "en-us/cloud-services",
      "language": "en-us",
      "normalized_input": {
        "path": "data/prod-html/en-us/pricing/cloud-services.html",
        "sha256": "fd0266473d6b79c22444e9a48d6751c2290ecc996a486efed80755a839b52f12"
      },
      "page_model": "FlexibleContentPage",
      "product_key": "cloud-services",
      "resource_key": "cloud-services",
      "resource_kind": "current",
      "slug": "cloud-services",
      "source": {
        "availability": "available",
        "cms_path": null,
        "path": "data/current_prod_html/en-us/pricing/details/cloud-services/index.html",
        "sha256": "fd0266473d6b79c22444e9a48d6751c2290ecc996a486efed80755a839b52f12",
        "url": "https://www.azure.cn/en-us/pricing/details/cloud-services/"
      },
      "strategy": "complex",
      "support_article_type": null
    },
    {
      "artifacts": {
        "diagnostic": {
          "path": "diagnostics/zh-cn/pricing/service-bus.sidecar.json"
        },
        "parseability": {
          "path": "diagnostics/zh-cn/pricing/service-bus.parseability.json"
        },
        "payload": {
          "path": "outputs/zh-cn/pricing/service-bus.json"
        },
        "validation": {
          "path": "validation/zh-cn/pricing/service-bus.validation.json"
        }
      },
      "capability_status": "supported",
      "catalog_categories": [
        "integration"
      ],
      "config": {
        "path": "data/configs/products/pricing/service-bus.json",
        "sha256": "7dad4a1ba650a9394c6fb099cd3883ef1e4761e920329a706053c53ae48a7989"
      },
      "item_id": "zh-cn/service-bus",
      "language": "zh-cn",
      "normalized_input": {
        "path": "data/prod-html/zh-cn/pricing/service-bus.html",
        "sha256": "72c8ff0a1a64e9a29e91b32cf0b463269f3fd9dc662e1ec064b3bdab0d1d3d32"
      },
      "page_model": "FlexibleContentPage",
      "product_key": "service-bus",
      "resource_key": "service-bus",
      "resource_kind": "current",
      "slug": "service-bus",
      "source": {
        "availability": "available",
        "cms_path": null,
        "path": "data/current_prod_html/zh-cn/pricing/details/service-bus/index.html",
        "sha256": "72c8ff0a1a64e9a29e91b32cf0b463269f3fd9dc662e1ec064b3bdab0d1d3d32",
        "url": "https://www.azure.cn/pricing/details/service-bus/"
      },
      "strategy": "simple_static",
      "support_article_type": null
    },
    {
      "artifacts": {
        "diagnostic": {
          "path": "diagnostics/en-us/pricing/service-bus.sidecar.json"
        },
        "parseability": {
          "path": "diagnostics/en-us/pricing/service-bus.parseability.json"
        },
        "payload": {
          "path": "outputs/en-us/pricing/service-bus.json"
        },
        "validation": {
          "path": "validation/en-us/pricing/service-bus.validation.json"
        }
      },